{
  "schemaVersion": "featureclip.evidence-manifest/v1",
  "repository": "HomenShum/FeatureClipStudio",
  "collectionId": "featureclip-nodekit-present-p1",
  "nodekitChangeId": "nodekit-factory-p1",
  "requireGitTracked": true,
  "artifacts": [
    {
      "id": "noderoom-hero-walkthrough",
      "title": "NodeRoom agent workflow walkthrough",
      "artifactKind": "clip",
      "path": "assets/feature-noderoom-hero.gif",
      "mediaType": "image/gif",
      "sha256": "e974f769bc097f23c901acc91384aa5426115a4472bb584e1d931a7c5147a008",
      "bytes": 2111742,
      "dimensions": {
        "width": 720,
        "height": 405
      },
      "sourceTruth": {
        "representation": "rendered-from-captured-product-ui",
        "captureEnvironment": "deployed-application",
        "artifactVerification": "repository-bytes",
        "workflowVerification": "unverified",
        "verificationReceipt": null
      },
      "basis": [
        {
          "path": "walkthrough.noderoom.specs.mjs",
          "digestMode": "normalized-text-sha256",
          "sha256": "23a6068b0f83dcd090ad08a4779fcf6278aa78a5182d863b05a4e7b5a56d9426"
        }
      ],
      "limitations": [
        "This selected historical asset has no workflow receipt reference. Matching bytes and declared metadata do not independently verify its provenance or depicted workflow.",
        "Historical supporting reference in original PR head 36dd7741e53a6cc66e4ea0eac48d8717fa60ee69: README.md, normalized-text-sha256 b2b9f0f4b1389ea9578c53040bec8941cad574aa2042510d58011ec6ea25f423. It changed on current main and is preserved as historical context, not rebound to this media.",
        "Historical supporting reference in original PR head 36dd7741e53a6cc66e4ea0eac48d8717fa60ee69: NODE-LOOPS.md, normalized-text-sha256 e7b926d35dea7be0cdeb1592dd2f56b920b2d30ae8a170eda1e81c30375f03e9. It changed on current main and is preserved as historical context, not rebound to this media.",
        "Active basis entries guard only retained supporting-file bytes. Representation and capture environment are historical declarations; this bridge does not recapture media or certify current application behavior, workflow outcomes, or pixels.",
        "Re-encoded 2026-10-10 with gifsicle (npm gifsicle@7.0.1) -O3 --lossy=3: a lossy near-lossless shrink with identical frame count (188), dimensions, delays and loop count; minimum per-frame SSIM 0.983813 against the original, as reported in PR #25. Previous bytes sha256 b443e36ac89a215027104576eb29c8bc4b258660872a43775390b6ab0f6a1673, 2843694 bytes. Pixels were not recaptured.",
        "Lead frames trimmed 2026-10-17: the first 4 frames (fade-in from the renderer's white letterbox, mean luminance 139/115/79/55 vs about 20; Defect D2, fixed in the renderer by 341fd20 after this GIF was rendered) were dropped at the byte level, so the loop no longer restarts on a flash. Remaining frames 4..187 are pixel-identical to the previous bytes (sha256 ec0addd6a402f60e23c0ad8cf7016d260c46cfe9c81f9f4d8fbf64df580dc244, 2154783 bytes); original frame 4 is stored as a full-canvas frame in the same global palette. Frame count 188 -> 184, loop count unchanged, per-frame delays of the kept frames unchanged. Pixels were not recaptured."
      ]
    },
    {
      "id": "room-os-v1-state-screenshot",
      "title": "Room OS V1 state evidence crop",
      "artifactKind": "screenshot",
      "path": "assets/room-os-v1-state-json.png",
      "mediaType": "image/png",
      "sha256": "44cef10aa164fb5491033bc596495b38d8a34ad63c2b53f466dfa18184bc48a8",
      "bytes": 178021,
      "dimensions": {
        "width": 1280,
        "height": 897
      },
      "sourceTruth": {
        "representation": "rendered-from-captured-product-ui",
        "captureEnvironment": "deployed-application",
        "artifactVerification": "repository-bytes",
        "workflowVerification": "unverified",
        "verificationReceipt": null
      },
      "basis": [
        {
          "path": "assets/room-os-v1-state.json",
          "digestMode": "normalized-text-sha256",
          "sha256": "9c23f7a0bd5593fec06fa5595c567812f4929f39946eed97bd1e99223a013fdd"
        },
        {
          "path": "walkthrough.roomos.mjs",
          "digestMode": "normalized-text-sha256",
          "sha256": "3f2b0e16daa2ce309e1e11d38e0a33ac90ee7a333a0b06c1831f8eec5663cbad"
        }
      ],
      "limitations": [
        "The crop is presentation evidence derived from captured state. It is not a fresh-browser receipt and must not be presented as one.",
        "Historical supporting reference in original PR head 36dd7741e53a6cc66e4ea0eac48d8717fa60ee69: README.md, normalized-text-sha256 b2b9f0f4b1389ea9578c53040bec8941cad574aa2042510d58011ec6ea25f423. It changed on current main and is preserved as historical context, not rebound to this media.",
        "Active basis entries guard only retained supporting-file bytes. Representation and capture environment are historical declarations; this bridge does not recapture media or certify current application behavior, workflow outcomes, or pixels."
      ]
    },
    {
      "id": "solo-founder-baseline-frame",
      "title": "Bundled SoloFounder captured baseline frame",
      "artifactKind": "screenshot",
      "path": "public/wt/SoloFounder/00.png",
      "mediaType": "image/png",
      "sha256": "382f000ab4fbc430138fde58b34f7905bbde99aaada1e06bfb5c7b1af2208e9f",
      "bytes": 675621,
      "dimensions": {
        "width": 2560,
        "height": 1600
      },
      "sourceTruth": {
        "representation": "captured-product-ui",
        "captureEnvironment": "local-fixture",
        "artifactVerification": "repository-bytes",
        "workflowVerification": "unverified",
        "verificationReceipt": null
      },
      "basis": [
        {
          "path": "walkthrough.solo-founder.specs.mjs",
          "digestMode": "normalized-text-sha256",
          "sha256": "3725d99e55838e04803af7674e3365f1bd99f62ab168a55e95362f06ea1d8a85"
        }
      ],
      "limitations": [
        "This is a checked-in worked-example frame from a local fixture, not evidence of a current production deployment.",
        "Historical supporting reference in original PR head 36dd7741e53a6cc66e4ea0eac48d8717fa60ee69: README.md, normalized-text-sha256 b2b9f0f4b1389ea9578c53040bec8941cad574aa2042510d58011ec6ea25f423. It changed on current main and is preserved as historical context, not rebound to this media.",
        "Historical supporting reference in original PR head 36dd7741e53a6cc66e4ea0eac48d8717fa60ee69: NODE-LOOPS.md, normalized-text-sha256 e7b926d35dea7be0cdeb1592dd2f56b920b2d30ae8a170eda1e81c30375f03e9. It changed on current main and is preserved as historical context, not rebound to this media.",
        "Active basis entries guard only retained supporting-file bytes. Representation and capture environment are historical declarations; this bridge does not recapture media or certify current application behavior, workflow outcomes, or pixels."
      ]
    }
  ]
}
